Rank,EntryId,EntryName,TimeRemaining,Points,Lineup,,Player,Roster Position,%Drafted,FPTS
350,1140254380,Phierlihy,0,83.1,P Kenta Maeda P David Price OF Mookie Betts SS Manny Machado OF Nick Markakis OF Denard Span 1B Yuli Gurriel 2B Chase Utley 3B Eduardo Núñez C Max Stassi,,,
351,1140221675,jordanh415 (6/6),0,82.95,P Kenta Maeda P Julio Teheran OF Wil Myers 2B Jed Lowrie SS Jurickson Profar OF Hunter Renfroe OF Manuel Margot 1B Matt Olson 3B Christian Villanueva C Tyler Flowers,,,
352,1140244389,enok321 (5/10),0,82.9,P Robbie Ray P Carlos Martínez OF Mookie Betts OF J.D. Martinez 2B Asdrúbal Cabrera OF Odúbel Herrera 1B Mitch Moreland 3B Maikel Franco SS Brock Holt C Jorge Alfaro,,,
353,1140240048,Vcag65,0,82.8,P David Price P Freddy Peralta OF Khris Davis SS Manny Machado OF Wil Myers C Yadier Molina OF Nelson Cruz 3B Yangervis Solarte 1B Yuli Gurriel 2B Dee Gordon,,,
354,1140245250,Memodelane (3/4),0,82.6,P Julio Teheran P Edwin Jackson OF Andrew Benintendi OF J.D. Martinez SS Eduardo Escobar OF Wil Myers 1B Freddie Freeman 3B Max Muncy 2B Jed Lowrie C Mike Zunino,,,
355,1140207857,MisterTees (10/10),0,82.55,P Tyler Anderson P Derek Holland OF A.J. Pollock 3B Nolan Arenado OF Charlie Blackmon 2B Brian Dozier OF Andrew McCutchen SS Jorge Polanco C Tom Murphy 1B Ryan McMahon,,,
356,1140273899,M4wood (4/8),0,82.5,P David Price P Tyler Anderson OF A.J. Pollock OF Randal Grichuk 2B Ketel Marte 3B Matt Chapman 1B Kendrys Morales SS Jean Segura OF Stephen Piscotty C John Ryan Murphy,,,
357,1140120410,TheBossinMyWorld (1/2),0,82.25,P Robbie Ray P Eric Lauer OF Mookie Betts 2B Ozzie Albies C J.T. Realmuto SS Eduardo Escobar OF Derek Dietrich OF Steven Souza Jr. 3B Johan Camargo 1B Justin Bour,,,
357,1140260331,PatVanPelt,0,82.25,P David Price P Derek Holland OF George Springer OF Joc Pederson 2B Jed Lowrie 1B Justin Smoak 3B Jurickson Profar SS Paul DeJong C Evan Gattis OF Marcell Ozuna,,,
359,1140240567,penninop (7/10),0,82.1,P David Price P Carlos Martínez OF Andrew Benintendi OF J.D. Martinez SS Jorge Polanco 1B Mitch Moreland OF Jackie Bradley Jr. 3B Mike Moustakas C Russell Martin 2B Brock Holt,,,
360,1140208013,ETxWC,0,81.95,P Kenta Maeda P Shane Bieber OF Rhys Hoskins OF Odúbel Herrera OF Nick Markakis 1B Carlos Santana 2B Starlin Castro 3B Maikel Franco SS Marcus Semien C Luke Maile,,,
360,1140236554,tincup450,0,81.95,P Gerrit Cole P Edwin Jackson OF Charlie Blackmon OF Eric Thames OF Jackie Bradley Jr. SS Dansby Swanson 3B Yandy Díaz 2B Yangervis Solarte 1B Yuli Gurriel C Alex Avila,,,
362,1140254263,Chunkyblue,0,81.9,P Robbie Ray P Carlos Martínez SS Francisco Lindor OF A.J. Pollock 1B Paul Goldschmidt OF Andrew McCutchen OF Manuel Margot 3B Mike Moustakas C Tyler Flowers 2B Dee Gordon,,,
362,1140268618,darsh314 (1/2),0,81.9,P Kenta Maeda P Robbie Ray OF J.D. Martinez OF Derek Dietrich OF Randal Grichuk 1B Justin Bour 3B Mike Moustakas C Russell Martin 2B Eduardo Núñez SS Brock Holt,,,
364,1140102868,YoDoggs (1/2),0,81.55,P Robbie Ray P Edwin Jackson OF A.J. Pollock OF Eddie Rosario 1B Paul Goldschmidt 3B Eduardo Escobar 2B Brian Dozier SS Jorge Polanco C Mitch Garver OF Jake Cave,,,
364,1140102879,YoDoggs (2/2),0,81.55,P Robbie Ray P Edwin Jackson OF A.J. Pollock OF Eddie Rosario 1B Paul Goldschmidt 3B Eduardo Escobar 2B Brian Dozier SS Jorge Polanco C Mitch Garver OF Jake Cave,,,
366,1140297962,snickalus (1/3),0,81.45,P David Price P Eric Lauer OF Christian Yelich OF J.D. Martinez 1B Paul Goldschmidt 2B Rougned Odor OF Eric Thames SS Xander Bogaerts C Yadier Molina 3B Christian Villanueva,,,
367,1140284496,jde25006 (2/2),0,81.25,P Derek Holland P Ervin Santana 3B José Ramírez OF Andrew Benintendi 1B Max Muncy 2B Brian Dozier SS Xander Bogaerts OF Odúbel Herrera OF Cody Bellinger C Max Stassi,,,
367,1140312727,CHEEZER7 (4/5),0,81.25,P Robbie Ray P Eric Lauer 2B Ozzie Albies OF A.J. Pollock OF Rhys Hoskins 1B Paul Goldschmidt SS Eduardo Escobar OF Ronald Acuña Jr. 3B Max Muncy C Austin Hedges,,,
369,1140140221,koryb7 (2/4),0,81.05,P Tyler Anderson P Edwin Jackson OF J.D. Martinez OF Rhys Hoskins C Yasmani Grandal OF Wil Myers SS Jorge Polanco 3B Johan Camargo 1B Justin Bour 2B Dee Gordon,,,
369,1140187523,Emac (6/10),0,81.05,P Robbie Ray P Derek Holland OF Eddie Rosario 1B Edwin Encarnacion 3B Matt Chapman 2B Jed Lowrie SS Jorge Polanco OF Max Kepler C Russell Martin OF Jake Cave,,,
369,1140254294,mirandatx (2/2),0,81.05,P Robbie Ray P Derek Holland OF Rhys Hoskins OF Charlie Blackmon 1B Paul Goldschmidt OF Michael Brantley C Buster Posey SS Yairo Muñoz 3B Mike Moustakas 2B Eduardo Núñez,,,
369,1140274533,drugsupplies,0,81.05,P Marco Estrada P Eric Lauer 3B José Ramírez SS Francisco Lindor OF A.J. Pollock OF Eddie Rosario C Yasmani Grandal 1B Paul Goldschmidt OF Joc Pederson 2B Asdrúbal Cabrera,,,
373,1140216360,ejwilson1977 (6/6),0,81,P David Price P Robbie Ray OF A.J. Pollock OF Khris Davis SS Eduardo Escobar 3B Matt Chapman C Evan Gattis 2B Yangervis Solarte OF Nick Martini 1B Tyler White,,,
374,1140321397,souperbihon (2/3),0,80.9,P Kenta Maeda P Robbie Ray OF Derek Dietrich OF Joc Pederson 2B Asdrúbal Cabrera 1B Justin Bour 3B Christian Villanueva SS Marcus Semien C Tyler Flowers OF Jake Cave,,,
375,1140254489,javimente15 (1/2),0,80.85,P Derek Holland P Marco Estrada OF Mookie Betts OF J.D. Martinez 3B Nolan Arenado 1B Paul Goldschmidt SS Eduardo Escobar OF Lorenzo Cain 2B Travis Shaw C Yan Gomes,,,
376,1140207837,MisterTees (7/10),0,80.05,P Robbie Ray P Derek Holland SS Francisco Lindor 1B Paul Goldschmidt OF Randal Grichuk OF Andrew McCutchen OF Curtis Granderson 3B Evan Longoria 2B Yangervis Solarte C Russell Martin,,,
377,1140277294,DeltaChiGolfer (4/4),0,79.65,P Freddy Peralta P Shane Bieber OF Mookie Betts SS Francisco Lindor OF Andrew Benintendi 2B César Hernández 1B Carlos Santana 3B Eduardo Núñez C Sandy Leon OF Greg Allen,,,
378,1140134454,lamondatd,0,79.4,P Gerrit Cole P David Price OF Teoscar Hernández SS Marcus Semien 3B Mike Moustakas OF Robbie Grossman C Russell Martin OF Ryan Braun 2B Dee Gordon 1B Ryon Healy,,,
378,1140151231,leelee620 (1/6),0,79.4,P Kenta Maeda P Tyler Anderson 1B Paul Goldschmidt 2B Brian Dozier SS Ketel Marte OF Steven Souza Jr. OF Manuel Margot OF José Pirela 3B Chase d'Arnaud C John Ryan Murphy,,,
380,1140276441,stormy88 (2/2),0,79.25,P Gerrit Cole P Wei-Yin Chen OF Andrew Benintendi OF Khris Davis 3B Matt Chapman SS Marcus Semien 2B Dee Gordon OF Nick Martini C Yan Gomes 1B Ryan McMahon,,,
380,1140283372,NYGpete (1/2),0,79.25,P Derek Holland P Ervin Santana OF Christian Yelich OF J.D. Martinez 3B Nolan Arenado OF Charlie Blackmon 2B Jed Lowrie SS Paul DeJong C Yan Gomes 1B Ryon Healy,,,
382,1140204560,MisterTees (2/10),0,79.05,P Robbie Ray P Derek Holland OF Eddie Rosario 1B Paul Goldschmidt 3B Eduardo Escobar 2B Brian Dozier OF Andrew McCutchen SS Jorge Polanco C Tyler Flowers OF Jake Cave,,,
383,1140240560,penninop (5/10),0,78.9,P Robbie Ray P Carlos Martínez 2B Ozzie Albies OF Michael Brantley OF Ronald Acuña Jr. 1B Freddie Freeman OF Nick Markakis SS Paul DeJong C Tyler Flowers 3B Martín Prado,,,
383,1140312364,souperbihon (1/3),0,78.9,P Kenta Maeda P Robbie Ray OF Derek Dietrich OF Joc Pederson 2B Asdrúbal Cabrera 1B Joe Mauer 3B Christian Villanueva SS Marcus Semien C Tyler Flowers OF Jake Cave,,,
385,1140221587,Jjustin329 (4/4),0,78.85,P Robbie Ray P Julio Teheran OF Andrew Benintendi OF Rhys Hoskins 1B Max Muncy SS Paul DeJong OF Curtis Granderson 3B Maikel Franco 2B Yangervis Solarte C Yan Gomes,,,
386,1140145066,edgar_ramirez,0,78.45,P David Price P Eric Lauer OF Mookie Betts SS Francisco Lindor OF Charlie Blackmon 1B Paul Goldschmidt 3B Max Muncy OF Steven Souza Jr. C Kurt Suzuki 2B Dee Gordon,,,
387,1140297834,bellbell70,0,78.35,P Kenta Maeda P Eric Lauer OF A.J. Pollock 1B Paul Goldschmidt OF Joc Pederson C Robinson Chirinos SS Nick Ahmed 2B Ketel Marte 3B Johan Camargo OF Cody Bellinger,,,
388,1140232763,smg2121,0,78.25,P Robbie Ray P Eric Lauer 3B José Ramírez SS Francisco Lindor OF A.J. Pollock 1B Paul Goldschmidt OF Wil Myers OF Joc Pederson C Yadier Molina 2B Dee Gordon,,,
389,1140209120,syobwoc2018 (1/3),0,78.05,P David Price P Julio Teheran OF Michael Brantley 2B Asdrúbal Cabrera SS Nick Ahmed C Yadier Molina OF Odúbel Herrera OF Nick Markakis 3B Johan Camargo 1B Cody Bellinger,,,
390,1140277211,MarkC18 (2/3),0,77.9,P Kenta Maeda P Robbie Ray 3B Matt Carpenter C Yasmani Grandal 1B Paul Goldschmidt 2B Ketel Marte OF Marcell Ozuna SS Kiké Hernández OF Roman Quinn OF Greg Allen,,,
391,1140321325,xstevex.2 (2/3),0,77.85,P Robbie Ray P Martín Pérez OF Mookie Betts OF Andrew Benintendi OF Rhys Hoskins C Yasmani Grandal SS Manny Machado 1B Max Muncy 2B César Hernández 3B Miguel Rojas,,,
392,1140325892,blipsNchitz,0,76.85,P Robbie Ray P Julio Teheran 2B Ozzie Albies OF Khris Davis OF Wil Myers 1B Max Muncy 3B Matt Chapman SS Johan Camargo C Tyler Flowers OF Dee Gordon,,,
393,1140278448,phillipscott (1/2),0,76.65,P Freddy Peralta P Shane Bieber 2B Ozzie Albies C J.T. Realmuto OF Ronald Acuña Jr. 1B Freddie Freeman SS Paul DeJong 3B Evan Longoria OF Denard Span OF Jake Marisnick,,,
394,1140298603,snickalus (3/3),0,76.25,P Gerrit Cole P Martín Pérez OF George Springer 2B Jed Lowrie 3B Jurickson Profar OF Chris Taylor OF Lorenzo Cain SS Paul DeJong 1B Matt Olson C Russell Martin,,,
395,1140187524,Emac (7/10),0,76.05,P Robbie Ray P Derek Holland OF Eddie Rosario 1B Edwin Encarnacion 2B Brian Dozier 3B Matt Chapman C Buster Posey SS Jorge Polanco OF Max Kepler OF Jake Cave,,,
396,1140122948,mullaner,0,75.35,P Kenta Maeda P Eric Lauer 2B Ozzie Albies 3B Matt Carpenter OF Charlie Blackmon SS Manny Machado C Yadier Molina OF Brian Anderson 1B Justin Bour OF José Pirela,,,
397,1140156205,leelee620 (5/6),0,75.15,P Kenta Maeda P Derek Holland OF A.J. Pollock 1B Paul Goldschmidt 2B Brian Dozier 3B Matt Chapman OF Stephen Piscotty OF Melky Cabrera C Tyler Flowers SS Andrew Romine,,,
398,1140300694,kapimpski1976 (2/2),0,75.05,P Tyler Anderson P Edwin Jackson OF J.D. Martinez OF Eddie Rosario 1B Paul Goldschmidt 3B Max Muncy 2B Jed Lowrie SS Chris Taylor C Buster Posey OF Jake Cave,,,
399,1140151502,leelee620 (2/6),0,74.9,P Kenta Maeda P Robbie Ray OF Eddie Rosario OF Brian Anderson OF Manuel Margot 1B Matt Olson 3B Christian Villanueva SS Marcus Semien C Tyler Flowers 2B Brandon Drury,,,
399,1140244390,enok321 (6/10),0,74.9,P Robbie Ray P Carlos Martínez OF Mookie Betts OF J.D. Martinez 2B César Hernández OF Odúbel Herrera 1B Mitch Moreland 3B Maikel Franco SS Brock Holt C Jorge Alfaro,,,
401,1140249036,fbtmayhem (1/3),0,74.65,P Gerrit Cole P Eric Lauer OF Wil Myers 2B César Hernández OF Odúbel Herrera 1B Carlos Santana OF Manuel Margot 3B Maikel Franco C Evan Gattis SS Aledmys Díaz,,,
402,1140199796,sdot76,0,74.6,P Freddy Peralta P Robbie Ray OF Eddie Rosario OF Michael Brantley 2B Brian Dozier 1B Joe Mauer SS Jorge Polanco OF Ender Inciarte C Mitch Garver 3B Chase d'Arnaud,,,
402,1140282624,M4wood (6/8),0,74.6,P Robbie Ray P Marco Estrada OF A.J. Pollock OF J.D. Martinez 1B Paul Goldschmidt SS Eduardo Escobar 2B Brian Dozier OF Steven Souza Jr. C Buster Posey 3B Brian Anderson,,,
404,1140244391,enok321 (7/10),0,74.5,P Kenta Maeda P Aaron Nola OF A.J. Pollock C Yadier Molina OF Nelson Cruz SS Jean Segura OF Mitch Haniger 2B Dee Gordon 3B Chase d'Arnaud 1B Ryon Healy,,,
405,1140234123,melmarco (1/2),0,74.3,P Tyler Anderson P Robbie Ray 1B Paul Goldschmidt SS Manny Machado OF Wil Myers 2B Jed Lowrie 3B Evan Longoria C Evan Gattis OF Ender Inciarte OF Mitch Haniger,,,
406,1140306202,Detonator44,0,74,P David Price P Robbie Ray 3B Eduardo Escobar 1B Max Muncy SS Xander Bogaerts OF Cody Bellinger OF Manuel Margot OF Nelson Cruz C Evan Gattis 2B Jason Kipnis,,,
407,1140204578,MisterTees (3/10),0,73.85,P Robbie Ray P Julio Teheran OF Mookie Betts OF J.D. Martinez 1B Paul Goldschmidt SS Eduardo Escobar OF Curtis Granderson 3B Yangervis Solarte 2B Eduardo Núñez C Sandy Leon,,,
408,1140277561,mjlcp2 (1/2),0,73.8,P David Price P Freddy Peralta OF Andrew Benintendi OF Eddie Rosario 2B César Hernández 1B Carlos Santana 3B Travis Shaw SS Miguel Rojas OF Nick Martini C Max Stassi,,,
409,1140310725,GatorBait267,0,73.65,P Gerrit Cole P Eric Lauer 1B Freddie Freeman 2B Jed Lowrie OF Chris Taylor OF Lorenzo Cain OF Nick Markakis 3B Johan Camargo SS Paul DeJong C Sandy Leon,,,
410,1140161507,gilbertformvp,0,73.5,P David Price P Tyler Anderson OF Christian Yelich OF Carlos González C Yasmani Grandal OF Ronald Acuña Jr. SS Jorge Polanco 2B Dee Gordon 3B Ryan McMahon 1B Tyler White,,,
410,1140284415,stormduhamel (2/5),0,73.5,P David Price P Tyler Anderson OF Eddie Rosario 1B Paul Goldschmidt 3B Max Muncy 2B Jed Lowrie OF Nick Markakis SS Johan Camargo C John Ryan Murphy OF Marwin González,,,
412,1140285490,fast_enough,0,73.3,P Tyler Anderson P Robbie Ray OF A.J. Pollock OF Khris Davis 1B Paul Goldschmidt SS Eduardo Escobar 3B Matt Chapman 2B Jason Kipnis OF Nick Martini C Luke Maile,,,
413,1140297965,snickalus (2/3),0,73.1,P Derek Holland P Julio Teheran OF Mookie Betts SS Manny Machado 2B Jed Lowrie 3B Jurickson Profar OF Nick Markakis OF Cody Bellinger 1B Mitch Moreland C Evan Gattis,,,
413,1140300889,cdodson50,0,73.1,P David Price P Carlos Martínez OF Charlie Blackmon OF Wil Myers C Yadier Molina 1B Ian Desmond OF Nick Markakis 2B Starlin Castro SS Jean Segura 3B Mike Moustakas,,,
415,1140275780,Shaunovery (4/10),0,73.05,P Robbie Ray P Derek Holland OF Mookie Betts 3B Matt Carpenter 2B Ketel Marte C Yadier Molina SS Paul DeJong 1B Mitch Moreland OF Marcell Ozuna OF Greg Allen,,,
416,1140128361,BigShotRobTX (2/10),0,72.35,P Kenta Maeda P Eric Lauer 3B José Ramírez OF A.J. Pollock OF Eddie Rosario OF Randal Grichuk 2B Ketel Marte 1B Joe Mauer SS Jorge Polanco C Mike Zunino,,,
416,1140267761,abragmania (5/10),0,72.35,P Kenta Maeda P Eric Lauer 2B Ozzie Albies OF Khris Davis 3B Nolan Arenado OF Charlie Blackmon OF Steven Souza Jr. SS Paul DeJong 1B Matt Olson C Tom Murphy,,,
418,1140133964,ejwilson1977 (2/6),0,71.35,P Tyler Anderson P Julio Teheran C Yasmani Grandal SS Manny Machado 3B Max Muncy OF Joc Pederson OF Randal Grichuk OF Chris Taylor 1B Kendrys Morales 2B Yangervis Solarte,,,
419,1140244392,enok321 (8/10),0,71.3,P Gerrit Cole P Kenta Maeda 3B Nolan Arenado OF Tony Kemp OF Dee Gordon 2B Chase d'Arnaud OF Jake Cave SS Marwin González C Mike Zunino 1B Tyler White,,,
420,1140251259,0079,0,71.05,P Robbie Ray P Derek Holland OF Charlie Blackmon SS Manny Machado 1B Joey Gallo OF Randal Grichuk 2B Jed Lowrie 3B Adrián Beltré OF Nick Markakis C John Ryan Murphy,,,
421,1140143098,learj7,0,71,P Kenta Maeda P Carlos Martínez OF J.D. Martinez 1B Paul Goldschmidt OF Derek Dietrich SS Jorge Polanco 2B Jason Kipnis OF Nick Martini C John Ryan Murphy 3B Martín Prado,,,
422,1140128360,BigShotRobTX (1/10),0,70.9,P Robbie Ray P Carlos Martínez OF Eddie Rosario 1B Paul Goldschmidt OF Wil Myers 3B Max Muncy OF Andrew McCutchen SS Jorge Polanco 2B Yangervis Solarte C John Ryan Murphy,,,
423,1140273897,M4wood (2/8),0,70.8,P David Price P Marco Estrada OF A.J. Pollock OF Khris Davis 1B Paul Goldschmidt OF Michael Brantley SS Nick Ahmed 2B Jed Lowrie C Buster Posey 3B Christian Villanueva,,,
424,1140254290,mirandatx (1/2),0,70.35,P Tyler Anderson P Julio Teheran 1B Edwin Encarnacion OF Michael Brantley OF Wil Myers C Yadier Molina 2B César Hernández 3B Jurickson Profar SS Johan Camargo OF Jackie Bradley Jr.,,,
425,1140330413,crobi31725 (2/10),0,70,P David Price P Robbie Ray OF A.J. Pollock 1B Paul Goldschmidt 2B Brian Dozier OF Steven Souza Jr. SS Paul DeJong OF Melky Cabrera 3B Mike Moustakas C John Ryan Murphy,,,
426,1140245247,Memodelane (2/4),0,69.9,P Shane Bieber P Julio Teheran OF Andrew Benintendi OF J.D. Martinez 1B Paul Goldschmidt SS Xander Bogaerts C Yadier Molina OF Nelson Cruz 2B Jason Kipnis 3B Eduardo Núñez,,,
426,1140295634,Yuda (1/5),0,69.9,P Kenta Maeda P Robbie Ray OF Wil Myers SS Nick Ahmed 1B Joe Mauer OF Hunter Renfroe OF Manuel Margot 3B Christian Villanueva C Tyler Flowers 2B José Pirela,,,
428,1140242046,Thunderkill79,0,69.85,P Robbie Ray P Julio Teheran 1B Paul Goldschmidt OF Wil Myers OF Tommy Pham OF Eric Thames SS Nick Ahmed 2B Ketel Marte C Evan Gattis 3B Mike Moustakas,,,
429,1140175410,cptnspaulding (2/10),0,69.35,P Carlos Martínez P Eric Lauer OF Mookie Betts OF J.D. Martinez OF Eddie Rosario 2B Brian Dozier SS Jorge Polanco 3B Miguel Sanó 1B Mitch Moreland C Mitch Garver,,,
430,1140164116,kpolo72,0,68.9,P Robbie Ray P Carlos Martínez OF A.J. Pollock 1B Paul Goldschmidt OF Wil Myers OF Andrew McCutchen C Buster Posey SS Jorge Polanco 3B Mike Moustakas 2B Dee Gordon,,,
430,1140244387,enok321 (3/10),0,68.9,P Robbie Ray P Carlos Martínez OF Mookie Betts OF J.D. Martinez 2B Asdrúbal Cabrera OF Odúbel Herrera 1B Mitch Moreland 3B Maikel Franco SS Scott Kingery C Sandy Leon,,,
430,1140258867,JPLMessy,0,68.9,P Julio Teheran P Wei-Yin Chen OF Christian Yelich SS Francisco Lindor 2B Ozzie Albies C Yasmani Grandal OF Derek Dietrich OF Nick Markakis 3B Johan Camargo 1B Justin Bour,,,
430,1140281455,Gerfdawg (6/7),0,68.9,P Kenta Maeda P Robbie Ray OF Mookie Betts OF Rhys Hoskins OF Brian Anderson 1B Justin Bour 2B Jason Kipnis C Tyler Flowers 3B Martín Prado SS Orlando Arcia,,,
430,1140282127,TKeSS,0,68.9,P Kenta Maeda P Robbie Ray OF A.J. Pollock 1B Paul Goldschmidt 3B Matt Chapman SS Jorge Polanco OF Melky Cabrera 2B Dee Gordon OF Nick Martini C Jonathan Lucroy,,,
435,1140132083,mrtjox1,0,68.05,P David Price P Julio Teheran 1B Paul Goldschmidt C Yadier Molina SS Jurickson Profar 3B Isiah Kiner-Falefa OF Lorenzo Cain OF Nick Markakis OF Jon Jay 2B Lourdes Gurriel Jr.,,,
436,1140209267,BeltWieldindad (6/10),0,67.9,P Kenta Maeda P Robbie Ray OF Wil Myers 1B Joe Mauer SS Jorge Polanco OF Max Kepler OF Hunter Renfroe 3B Evan Longoria C Tyler Flowers 2B José Pirela,,,
437,1140249049,notantswon,0,66.2,P Gerrit Cole P Robbie Ray 1B Paul Goldschmidt SS Eduardo Escobar OF Melky Cabrera 2B Yangervis Solarte OF Jake Cave C John Ryan Murphy 3B Ryan McMahon OF Greg Allen,,,
438,1140284044,sstone01,0,66.1,P Kenta Maeda P David Price 1B Paul Goldschmidt 2B Brian Dozier SS Ketel Marte OF Melky Cabrera 3B Mike Moustakas OF Robbie Grossman OF Nick Martini C John Ryan Murphy,,,
439,1140295635,Yuda (2/5),0,65.9,P Robbie Ray P Carlos Martínez 2B Ozzie Albies OF Eddie Rosario 1B Joe Mauer C Buster Posey SS Jorge Polanco OF Max Kepler 3B Evan Longoria OF Jake Cave,,,
440,1140283555,Immaculate11 (1/3),0,65.5,P David Price P Tyler Anderson OF Eddie Rosario 2B Brian Dozier OF Lorenzo Cain 1B Joe Mauer OF Nick Markakis SS Jorge Polanco 3B Miguel Sanó C Luke Maile,,,
441,1140202108,Autzen4life (3/4),0,65.05,P Marco Estrada P Eric Lauer OF Mookie Betts SS Francisco Lindor 2B Ozzie Albies OF A.J. Pollock C Yasmani Grandal OF Ronald Acuña Jr. 1B Freddie Freeman 3B Christian Villanueva,,,
442,1140232154,Dexter8,0,64.25,P Robbie Ray P Eric Lauer 2B Ozzie Albies OF J.D. Martinez 3B Matt Carpenter C Yasmani Grandal 1B Paul Goldschmidt OF Randal Grichuk SS Ketel Marte OF Melky Cabrera,,,
443,1140243992,ziggypool (1/10),0,64.05,P Julio Teheran P Ervin Santana 2B Ozzie Albies OF A.J. Pollock SS Elvis Andrus 1B Freddie Freeman 3B Matt Chapman OF Nick Markakis OF Manuel Margot C Tyler Flowers,,,
444,1140283487,roger3646,0,63.95,P Kenta Maeda P Wei-Yin Chen OF A.J. Pollock OF George Springer SS Manny Machado 1B Eric Thames 2B Brian Dozier 3B Maikel Franco C Kurt Suzuki OF Denard Span,,,
445,1140245940,acherney5,0,63.7,P Gerrit Cole P Tyler Anderson OF J.D. Martinez OF Rhys Hoskins 2B Starlin Castro 3B Mike Moustakas C Luke Maile OF Ben Gamel SS Orlando Arcia 1B Tyler White,,,
446,1140263746,gwensphyre77 (1/2),0,63.4,P Aaron Nola P Robbie Ray OF A.J. Pollock 1B Paul Goldschmidt 3B Max Muncy OF Yasiel Puig OF Alex Verdugo SS Kiké Hernández C Alex Avila 2B Chase Utley,,,
446,1140266030,gwensphyre77 (2/2),0,63.4,P Aaron Nola P Robbie Ray OF A.J. Pollock 1B Paul Goldschmidt 3B Max Muncy OF Yasiel Puig OF Alex Verdugo SS Kiké Hernández C Alex Avila 2B Chase Utley,,,
448,1140187521,Emac (4/10),0,63.05,P Robbie Ray P Derek Holland 2B Ozzie Albies OF Eddie Rosario 1B Joe Mauer C Buster Posey SS Jorge Polanco OF Max Kepler 3B Christian Villanueva OF Jake Cave,,,
449,1140209265,BeltWieldindad (4/10),0,62.9,P Kenta Maeda P Robbie Ray OF Wil Myers OF Joc Pederson 1B Joe Mauer C Buster Posey SS Jorge Polanco 3B Evan Longoria 2B Chase d'Arnaud OF Jake Cave,,,
450,1140308528,Kmartino (4/4),0,61.9,P Robbie Ray P Carlos Martínez OF A.J. Pollock 1B Paul Goldschmidt OF Michael Brantley 2B Brian Dozier 3B Johan Camargo SS Paul DeJong OF Ender Inciarte C John Ryan Murphy,,,
451,1140131251,jamesberg,0,61.25,P Gerrit Cole P Julio Teheran 1B Freddie Freeman OF Nick Markakis 3B Maikel Franco OF Ender Inciarte OF Robbie Grossman 2B Dee Gordon SS Scott Kingery C Luke Maile,,,
452,1140244388,enok321 (4/10),0,60.9,P Robbie Ray P Carlos Martínez OF Mookie Betts OF J.D. Martinez 2B César Hernández OF Odúbel Herrera 1B Mitch Moreland 3B Maikel Franco SS Scott Kingery C Sandy Leon,,,
453,1140238454,delawaredestroyer (3/3),0,60.6,P Freddy Peralta P Robbie Ray OF A.J. Pollock OF Charlie Blackmon 1B Paul Goldschmidt OF Jon Jay SS Paul DeJong 3B Mike Moustakas 2B Jason Kipnis C John Ryan Murphy,,,
454,1140235179,TEJOHN22 (2/2),0,60.3,P Gerrit Cole P Kenta Maeda OF Wil Myers OF Manuel Margot OF José Pirela SS Freddy Galvis 1B Eric Hosmer 3B Martín Prado C Luke Maile 2B Andrew Romine,,,
455,1140284858,Scrooge1515 (2/4),0,60.25,P Robbie Ray P Eric Lauer OF Christian Yelich OF A.J. Pollock OF Eddie Rosario 1B Paul Goldschmidt SS Eduardo Escobar 2B Ketel Marte C Evan Gattis 3B Mike Moustakas,,,
456,1140272176,gottmn (3/4),0,60.05,P Robbie Ray P Derek Holland OF A.J. Pollock OF Eddie Rosario 1B Paul Goldschmidt 3B Eduardo Escobar 2B Brian Dozier SS Jorge Polanco OF Jake Cave C Mike Zunino,,,
457,1140214396,jordanh415 (4/6),0,58.9,P Kenta Maeda P Robbie Ray OF Eddie Rosario OF Khris Davis SS Jorge Polanco 1B Matt Olson 3B Yangervis Solarte C Tyler Flowers 2B Dee Gordon OF Jake Cave,,,
457,1140305046,Kmartino (2/4),0,58.9,P Robbie Ray P Carlos Martínez OF A.J. Pollock 1B Paul Goldschmidt OF Michael Brantley 2B Brian Dozier OF Andrew McCutchen SS Paul DeJong 3B Mike Moustakas C John Ryan Murphy,,,
459,1140273839,Gerfdawg (4/7),0,57.95,P Kenta Maeda P Shane Bieber OF Mookie Betts OF J.D. Martinez SS Johan Camargo OF Nelson Cruz 2B Dee Gordon 1B Ryon Healy C Max Stassi 3B Ryan McMahon,,,
459,1140273853,Gerfdawg (5/7),0,57.95,P Kenta Maeda P Shane Bieber OF Mookie Betts OF J.D. Martinez SS Johan Camargo OF Nelson Cruz 2B Dee Gordon 1B Ryon Healy C Max Stassi 3B Ryan McMahon,,,
461,1140214389,jordanh415 (1/6),0,57.05,P Robbie Ray P Derek Holland OF Mookie Betts OF J.D. Martinez SS Paul DeJong 1B Mitch Moreland OF Jackie Bradley Jr. 3B Evan Longoria 2B Jedd Gyorko C Jorge Alfaro,,,
462,1140214642,jayvee141,0,55.65,P Marco Estrada P Wei-Yin Chen OF Christian Yelich OF J.D. Martinez OF Rhys Hoskins 3B Alex Bregman 1B Paul Goldschmidt 2B Rougned Odor SS Ketel Marte C Buster Posey,,,
463,1140258997,LedBlimp,0,54,P Gerrit Cole P Freddy Peralta OF Mookie Betts 1B Freddie Freeman 2B Jason Kipnis OF Josh Reddick 3B Kyle Seager OF Mac Williamson SS Orlando Arcia C Juan Centeno,,,
464,1140284284,stormduhamel (1/5),0,51.9,P Kenta Maeda P Robbie Ray OF Charlie Blackmon OF Nick Markakis C Buster Posey 3B Johan Camargo 1B Cody Bellinger OF Teoscar Hernández 2B Yangervis Solarte SS Marwin González,,,
465,1140212147,TDKINGS,0,50.3,P Tyler Anderson P Robbie Ray 2B Ozzie Albies OF A.J. Pollock 1B Paul Goldschmidt SS Eduardo Escobar 3B Mike Moustakas OF Magneuris Sierra OF Ryan Braun C John Ryan Murphy,,,
466,1140184054,cheetah917 (2/2),0,50.05,P David Price P Wei-Yin Chen OF Mookie Betts OF Andrew Benintendi OF J.D. Martinez C Yasmani Grandal 3B Jurickson Profar 1B Mitch Moreland 2B Starlin Castro SS Miguel Rojas,,,
467,1140322600,xstevex.2 (3/3),0,48.7,P Kenta Maeda P Marco Estrada OF Mookie Betts OF J.D. Martinez 3B Max Muncy OF Joc Pederson C Buster Posey SS Brandon Crawford 2B Brock Holt 1B Ryon Healy,,,
468,1140254344,dluzier131 (1/2),0,47.9,P Shane Bieber P Wei-Yin Chen OF Christian Yelich OF Andrew Benintendi 2B Ozzie Albies 3B Eduardo Escobar 1B Joey Gallo C Yadier Molina SS Yairo Muñoz OF Nelson Cruz,,,
468,1140261747,dluzier131 (2/2),0,47.9,P Shane Bieber P Wei-Yin Chen OF Christian Yelich OF Andrew Benintendi 2B Ozzie Albies 3B Eduardo Escobar 1B Joey Gallo C Yadier Molina SS Yairo Muñoz OF Nelson Cruz,,,
470,1140249055,thor9,0,47.3,P Wei-Yin Chen P Eric Lauer OF Mookie Betts SS Francisco Lindor OF Andrew Benintendi 2B Ozzie Albies OF J.D. Martinez C J.T. Realmuto 1B Freddie Freeman 3B Evan Longoria,,,
471,1140175412,cptnspaulding (4/10),0,47.05,P Freddy Peralta P Eric Lauer OF Mookie Betts OF Andrew Benintendi OF J.D. Martinez SS Xander Bogaerts 3B Matt Chapman 2B Jed Lowrie 1B Matt Olson C Sandy Leon,,,
472,1140282574,Gerfdawg (7/7),0,43.9,P Kenta Maeda P Robbie Ray OF Mookie Betts OF J.D. Martinez OF Nelson Cruz SS Jean Segura 2B Dee Gordon 1B Ryon Healy C Max Stassi 3B Ryan McMahon,,,
473,1140296024,Scrooge1515 (3/4),0,39.8,P Freddy Peralta P Ervin Santana OF Christian Yelich OF Eddie Rosario OF George Springer 2B Brian Dozier 1B Justin Bour C Evan Gattis 3B Mike Moustakas SS Marwin González,,,
474,1140274874,dreday7,0,38.05,P David Price P Julio Teheran OF Mookie Betts OF Andrew Benintendi OF J.D. Martinez SS Chris Taylor 1B Mitch Moreland 2B Dee Gordon 3B Ryan McMahon C Luke Maile,,,
475,1140305403,dkcuse (1/2),0,32.85,P Derek Holland P Marco Estrada OF Mookie Betts OF Andrew Benintendi OF J.D. Martinez 3B Eduardo Escobar SS Xander Bogaerts 1B Mitch Moreland 2B Starlin Castro C Tom Murphy,,,
