Rank,EntryId,EntryName,TimeRemaining,Points,Lineup,,Player,Roster Position,%Drafted,FPTS
333,1157965886,SKG1000 (13/14),0,78.25,P Max Scherzer P Junior Guerra 1B Cody Bellinger 2B Joey Wendle OF Andrew McCutchen OF Kevin Kiermaier OF Kiké Hernández SS Nick Ahmed C Tucker Barnhart 3B Maikel Franco,,,
334,1157803740,BigShotRobTX (10/10),0,77.9,P Clay Buchholz P Julio Teheran 2B Rougned Odor OF Randal Grichuk 1B Steve Pearce SS Jurickson Profar OF Kevin Pillar OF Derek Dietrich 3B Adrián Beltré C Chris Iannetta,,,
334,1158005134,skaines (6/14),0,77.9,P Madison Bumgarner P Julio Teheran SS Manny Machado 1B Freddie Freeman 2B Robinson Canó OF George Springer OF José Martínez OF Mikie Mahtook C Kevin Plawecki 3B David Bote,,,
336,1157912445,DGARRENS73,0,77.85,P Charlie Morton P Félix Hernández 3B Alex Bregman 1B Matt Carpenter C Yasmani Grandal 2B Jose Altuve SS Marwin González OF Josh Reddick OF Jackie Bradley Jr. OF Kole Calhoun,,,
337,1157906096,Patrick_Star (2/14),0,77.7,P Max Scherzer P Ivan Nova OF Randal Grichuk 1B Justin Smoak OF Daniel Palka SS Aledmys Díaz 3B Matt Davidson C Omar Narváez 2B Devon Travis OF Adam Engel,,,
337,1157906105,Patrick_Star (11/14),0,77.7,P Max Scherzer P Ivan Nova OF Michael Brantley 1B Edwin Encarnacion OF Melky Cabrera 3B Matt Duffy SS Willy Adames C Yan Gomes OF Jake Bauers 2B Brandon Lowe,,,
339,1157944571,maygi557 (1/5),0,77.35,P Walker Buehler P Madison Bumgarner 3B Justin Turner 2B DJ LeMahieu 1B Tyler White C Omar Narváez OF Franmil Reyes OF Steven Duggar OF Adam Engel SS Amed Rosario,,,
340,1157953080,UGAMAN11,0,77.25,P Max Scherzer P Junior Guerra OF Ronald Acuña Jr. OF Avisaíl García SS Johan Camargo 2B Jason Kipnis C Robinson Chirinos OF Trey Mancini 3B Tim Beckham 1B Albert Pujols,,,
340,1157965880,SKG1000 (7/14),0,77.25,P Max Scherzer P Junior Guerra OF Cody Bellinger OF Nick Markakis OF José Martínez SS Willy Adames 1B Tyler White 2B Jeff McNeil C Tucker Barnhart 3B Maikel Franco,,,
342,1157960972,Emac (11/14),0,77.1,P Lance Lynn P Brian Johnson OF J.D. Martinez OF Andrew Benintendi 3B Miguel Andújar 1B Mitch Moreland 2B Travis Shaw OF George Springer SS Amed Rosario C René Rivera,,,
343,1158005137,skaines (7/14),0,76.7,P Max Scherzer P Ivan Nova SS Alex Bregman 1B Jesús Aguilar 2B Jonathan Villar OF Travis Jankowski OF Billy Hamilton OF Corey Dickerson C Kevin Plawecki 3B Colin Moran,,,
344,1157965876,SKG1000 (3/14),0,76.25,P Max Scherzer P Junior Guerra OF Cody Bellinger OF Nick Markakis OF Kevin Kiermaier SS Kiké Hernández 1B Tyler White C Tucker Barnhart 3B Maikel Franco 2B Ketel Marte,,,
345,1157986440,Chunkyblue,0,75.65,P Charlie Morton P Lance Lynn OF Giancarlo Stanton OF Joc Pederson OF George Springer 3B Todd Frazier 1B Daniel Murphy C Salvador Perez 2B Devon Travis SS Amed Rosario,,,
346,1157966882,dofunnies (3/10),0,75.6,P Brian Johnson P Ivan Nova OF J.D. Martinez OF Mookie Betts OF Andrew Benintendi SS Xander Bogaerts 1B Mitch Moreland 2B DJ LeMahieu 3B Anthony Rendon C Kevin Plawecki,,,
347,1157981780,botobrody (6/11),0,75.55,P Cole Hamels P Matthew Boyd OF Giancarlo Stanton OF Aaron Hicks 1B Jesús Aguilar OF Lorenzo Cain 3B Travis Shaw C Erik Kratz 2B Ronald Torreyes SS Orlando Arcia,,,
348,1157945284,BeltWieldindad (5/14),0,75.45,P Lance Lynn P Matthew Boyd SS Manny Machado OF Giancarlo Stanton OF Joc Pederson C Yasmani Grandal OF Brett Gardner 1B Greg Bird 3B Eduardo Núñez 2B Ronald Torreyes,,,
349,1157953755,ImnotNavT (10/14),0,75.4,P Max Scherzer P Félix Hernández 2B Jose Altuve SS Carlos Correa OF Marwin González OF George Springer 3B Todd Frazier 1B Tyler White C Kevin Plawecki OF Austin Jackson,,,
350,1157985906,maygi557 (5/5),0,75.1,P Julio Teheran P Brian Johnson OF Mike Trout OF J.D. Martinez 3B Matt Carpenter SS Marwin González 2B Jedd Gyorko 1B José Martínez OF Eric Young Jr. C Caleb Joseph,,,
351,1157883054,Treys (2/2),0,74.55,P Jacob deGrom P Julio Teheran 3B Nolan Arenado OF Adam Frazier 1B Tyler White 2B Daniel Murphy OF Trey Mancini SS José Iglesias C Curt Casali OF Austin Jackson,,,
352,1157946852,LethargicLinemen (2/14),0,74.3,P Max Scherzer 3B Justin Turner OF Andrew Benintendi OF Lorenzo Cain OF Brett Gardner 1B Daniel Murphy 2B Devon Travis SS Amed Rosario C Victor Caratini P Noé Ramírez,,,
353,1157965884,SKG1000 (11/14),0,74.25,P Max Scherzer P Junior Guerra OF Cody Bellinger OF Nick Markakis OF Kiké Hernández 1B Tyler White SS Nick Ahmed 2B Jeff McNeil C Tucker Barnhart 3B Maikel Franco,,,
354,1157965189,andrealking2 (4/14),0,74.2,P Max Scherzer P Julio Teheran 3B Wil Myers OF George Springer OF Travis Jankowski SS Freddy Galvis C Austin Hedges OF Jorge Bonifacio 1B Hunter Dozier 2B Luis Urías,,,
355,1158013875,whoisjohngalt420 (5/6),0,74.1,P Madison Bumgarner P Brian Johnson OF J.D. Martinez 3B Wil Myers SS Marwin González 1B Eric Hosmer OF George Springer OF Andrew McCutchen 2B Niko Goodrum C Tucker Barnhart,,,
356,1157981775,botobrody (1/11),0,74.05,P Cole Hamels P Junior Guerra OF J.D. Martinez OF Mookie Betts SS Xander Bogaerts 2B Javier Báez 1B Daniel Murphy 3B Eduardo Núñez OF Blake Swihart C Victor Caratini,,,
357,1157986940,jamessoldier (3/6),0,73.85,P Charlie Morton P Félix Hernández 3B Alex Bregman OF Giancarlo Stanton 2B Jose Altuve SS Carlos Correa OF Brett Gardner OF George Springer 1B Daniel Murphy C Victor Caratini,,,
358,1157946857,LethargicLinemen (4/14),0,73.3,P Max Scherzer SS Francisco Lindor OF Joc Pederson OF Lorenzo Cain OF Brett Gardner 3B Jeimer Candelario 1B Daniel Murphy 2B Devon Travis C Victor Caratini P Noé Ramírez,,,
359,1157985087,lmv23 (1/2),0,73.2,P Max Scherzer P Jacob Nix OF A.J. Pollock OF Starling Marte OF George Springer 1B Tyler Austin SS Trevor Story 2B Lourdes Gurriel Jr. 3B Todd Frazier C Yadier Molina,,,
360,1157903214,genteel1,0,73.15,P Aaron Nola P Junior Guerra OF J.D. Martinez OF Mookie Betts OF Andrew Benintendi 1B Mitch Moreland 3B Eduardo Núñez 2B Luis Urías SS Orlando Arcia C René Rivera,,,
361,1158005230,whoisjohngalt420 (1/6),0,73.1,P Madison Bumgarner P Brian Johnson OF Mookie Betts 3B Wil Myers SS Marwin González 1B Eric Hosmer OF George Springer OF Andrew McCutchen 2B Niko Goodrum C Tucker Barnhart,,,
362,1157960887,MNRaider (9/14),0,72.65,P Charlie Morton P Lance Lynn OF Ryan Braun 1B Jesús Aguilar OF Lorenzo Cain 2B Travis Shaw 3B Brian Anderson SS Miguel Rojas OF Isaac Galloway C Erik Kratz,,,
363,1157772597,phenomental,0,72.35001,P Carlos Carrasco P Charlie Morton OF Adam Frazier 3B Renato Núñez C Yan Gomes 2B César Hernández 1B Jake Bauers SS Miguel Rojas OF Billy Hamilton OF Michael Conforto,,,
364,1157812374,cptnspaulding (7/14),0,72.25,P Charlie Morton P Jakob Junis OF Ryan Braun 1B Jesús Aguilar 3B Mike Moustakas OF Teoscar Hernández SS Aledmys Díaz OF Billy McKinney C Danny Jansen 2B Devon Travis,,,
364,1157965877,SKG1000 (4/14),0,72.25,P Max Scherzer P Junior Guerra OF Mitch Haniger OF Cody Bellinger OF José Martínez 1B Tyler White 2B Jeff McNeil C Tucker Barnhart 3B Maikel Franco SS Ketel Marte,,,
366,1158013303,skaines (13/14),0,72.05,P Cole Hamels P Junior Guerra OF Mookie Betts SS Alex Bregman OF Aaron Hicks OF George Springer C Yadier Molina 1B Daniel Murphy 3B Adrián Beltré 2B Luis Urías,,,
367,1157896139,gnevins31,0,71.9,P Clay Buchholz P Lance Lynn OF Whit Merrifield OF Bryce Harper OF Marwin González 2B Gleyber Torres C Salvador Perez 1B Luke Voit SS Amed Rosario 3B David Bote,,,
367,1157955984,LethargicLinemen (14/14),0,71.9,P Max Scherzer P Ryne Stanek OF Andrew Benintendi 3B Matt Carpenter OF Joc Pederson OF Brett Gardner 1B Daniel Murphy 2B Devon Travis SS Amed Rosario C Victor Caratini,,,
369,1157889451,FreeSoda (6/14),0,71.65,P Aaron Nola P Matthew Boyd OF Giancarlo Stanton 3B Miguel Andújar SS Javier Báez 2B Gleyber Torres 1B Luke Voit OF Michael Conforto C Kevin Plawecki OF Austin Jackson,,,
370,1157922054,Shaunovery (3/14),0,71.4,P Julio Teheran P Ivan Nova 3B José Ramírez SS Francisco Lindor OF Michael Brantley 1B Edwin Encarnacion 2B Javier Báez OF Melky Cabrera OF Juan Soto C Austin Hedges,,,
370,1157988530,timothylee74 (1/14),0,71.4,P Max Scherzer P Aaron Nola SS José Iglesias OF Kole Calhoun OF Adam Engel 1B Victor Martinez OF Craig Gentry 3B Taylor Ward 2B Ronny Rodriguez C Grayson Greiner,,,
372,1157955967,LethargicLinemen (10/14),0,71.3,P Max Scherzer 3B Justin Turner OF Andrew Benintendi OF Lorenzo Cain OF Brett Gardner 1B Daniel Murphy 2B Devon Travis SS Elvis Andrus C Victor Caratini P Noé Ramírez,,,
373,1158013889,whoisjohngalt420 (6/6),0,71.1,P Madison Bumgarner P Brian Johnson OF Andrew Benintendi 1B Mitch Moreland 3B Wil Myers SS Marwin González OF George Springer OF Andrew McCutchen 2B Niko Goodrum C Tucker Barnhart,,,
374,1157955974,LethargicLinemen (12/14),0,70.9,P Max Scherzer P Ryne Stanek 3B Justin Turner OF Joc Pederson OF Brett Gardner SS Lourdes Gurriel Jr. 1B Daniel Murphy OF Billy Hamilton 2B Devon Travis C Victor Caratini,,,
375,1157852441,charlesrayallday (9/14),0,70.75,P Max Scherzer P Matthew Boyd OF Gregory Polanco OF Starling Marte 3B Todd Frazier C Salvador Perez 2B Jeff McNeil OF Corey Dickerson SS Amed Rosario 1B Josh Bell,,,
376,1157988851,timothylee74 (2/14),0,70.6,P Max Scherzer P Jack Flaherty SS José Iglesias OF Kole Calhoun OF Adam Engel 1B Victor Martinez OF Craig Gentry 3B Taylor Ward 2B Ronny Rodriguez C Grayson Greiner,,,
377,1157975477,dofunnies (6/10),0,70.4,P Thomas Pannone P Edwin Jackson 3B José Ramírez SS Francisco Lindor OF Bryce Harper 1B Justin Smoak OF Teoscar Hernández 2B Lourdes Gurriel Jr. OF Billy McKinney C Danny Jansen,,,
378,1157891735,9ordo6 (11/14),0,70.35,P Jack Flaherty P Junior Guerra OF Giancarlo Stanton 3B Matt Carpenter OF Joc Pederson OF Tyler O'Neill SS Paul DeJong C Yadier Molina 1B Luke Voit 2B Greg Garcia,,,
379,1157928983,Jodonski,0,69.55,P Jakob Junis P Junior Guerra OF Mike Trout 3B José Ramírez OF Giancarlo Stanton OF Bryce Harper SS Javier Báez 1B Anthony Rizzo 2B Gleyber Torres C René Rivera,,,
380,1157955969,LethargicLinemen (11/14),0,69.3,P Max Scherzer 3B Justin Turner OF Andrew Benintendi OF Brett Gardner 2B Lourdes Gurriel Jr. 1B Daniel Murphy OF Billy Hamilton SS Amed Rosario C Victor Caratini P Noé Ramírez,,,
381,1157965883,SKG1000 (10/14),0,69.25,P Max Scherzer P Junior Guerra 1B Max Muncy OF Nick Markakis OF Kevin Kiermaier OF Kiké Hernández 2B Jeff McNeil C Tucker Barnhart 3B Maikel Franco SS Ketel Marte,,,
382,1157945291,BeltWieldindad (12/14),0,69.2,P Charlie Morton P Matthew Boyd 3B Justin Turner OF Joc Pederson C Yasmani Grandal 2B Brian Dozier 1B Greg Bird OF Michael Conforto SS Amed Rosario OF Austin Jackson,,,
382,1157965181,andrealking2 (2/14),0,69.2,P Max Scherzer P Julio Teheran 2B Jose Altuve OF George Springer 1B Tyler White C Salvador Perez OF Jorge Bonifacio 3B Hunter Dozier SS Alcides Escobar OF Rosell Herrera,,,
384,1157989861,timothylee74 (6/14),0,68.55,P Max Scherzer P Kyle Freeland SS José Iglesias OF Kole Calhoun OF Adam Engel 1B Victor Martinez OF Craig Gentry 3B Taylor Ward 2B Ronny Rodriguez C Grayson Greiner,,,
385,1157946859,LethargicLinemen (5/14),0,68.3,P Max Scherzer 3B Justin Turner OF Joc Pederson OF Lorenzo Cain OF Brett Gardner 2B Lourdes Gurriel Jr. 1B Daniel Murphy SS Elvis Andrus C Victor Caratini P Noé Ramírez,,,
385,1157989541,timothylee74 (5/14),0,68.3,P Max Scherzer P Cole Hamels SS José Iglesias OF Kole Calhoun OF Adam Engel 1B Victor Martinez OF Craig Gentry 3B Taylor Ward 2B Ronny Rodriguez C Grayson Greiner,,,
387,1157965882,SKG1000 (9/14),0,68.25,P Max Scherzer P Junior Guerra 1B Cody Bellinger OF Wil Myers OF Nick Markakis OF Kevin Kiermaier 2B Jeff McNeil C Tucker Barnhart 3B Maikel Franco SS Ketel Marte,,,
388,1157990169,sydax1234,0,67.85,P Julio Teheran P Edwin Jackson OF J.D. Martinez OF Khris Davis 3B Nolan Arenado 2B Ozzie Albies SS Eduardo Escobar OF Billy McKinney C Danny Jansen 1B Albert Pujols,,,
389,1157906103,Patrick_Star (9/14),0,67.7,P Max Scherzer P Ivan Nova OF Nelson Cruz 1B Justin Smoak OF Teoscar Hernández SS Lourdes Gurriel Jr. 2B Dee Gordon OF Billy McKinney 3B Kyle Seager C Mike Zunino,,,
390,1157922047,Shaunovery (2/14),0,67.5,P Lance Lynn P Jakob Junis 3B Alex Bregman OF Denard Span 2B Jose Altuve SS Carlos Correa 1B Yuli Gurriel OF Marwin González OF Juan Soto C Curt Casali,,,
391,1157922069,Shaunovery (6/14),0,67.4,P Julio Teheran P Ivan Nova OF J.D. Martinez OF Mookie Betts OF Andrew Benintendi SS Xander Bogaerts 1B Mitch Moreland C Austin Hedges 2B Ketel Marte 3B Colin Moran,,,
392,1157977315,ejwilson1977,0,66.9,P Julio Teheran P James Shields OF Mookie Betts OF Andrew Benintendi SS Alex Bregman 2B Jose Altuve OF George Springer 1B Tyler White 3B Kyle Seager C Michael Pérez,,,
393,1157965202,andrealking2 (9/14),0,66.65,P Charlie Morton P Madison Bumgarner OF Mike Trout 3B José Ramírez OF Mikie Mahtook 1B Albert Pujols SS José Iglesias OF Kole Calhoun 2B David Fletcher C René Rivera,,,
394,1158013363,whoisjohngalt420 (4/6),0,66.35,P Madison Bumgarner P Kyle Gibson OF Mookie Betts 3B Wil Myers SS Marwin González 1B Eric Hosmer OF George Springer OF Andrew McCutchen 2B Niko Goodrum C Tucker Barnhart,,,
395,1157990077,timothylee74 (7/14),0,66.2,P Max Scherzer P Madison Bumgarner SS José Iglesias OF Kole Calhoun OF Adam Engel 1B Victor Martinez OF Craig Gentry 3B Taylor Ward 2B Ronny Rodriguez C Grayson Greiner,,,
396,1157964520,loucards61,0,64.95,P Junior Guerra P Jacob Nix OF J.D. Martinez SS Manny Machado 1B Max Muncy OF Ronald Acuña Jr. 3B Alex Bregman 2B Rougned Odor OF Juan Soto C Yadier Molina,,,
396,1157964660,bonecrusher1982,0,64.95,P Max Scherzer P Charlie Morton 2B Lourdes Gurriel Jr. OF Billy Hamilton 1B Trey Mancini C Curt Casali SS Brandon Crawford OF Jorge Bonifacio OF Albert Almora Jr. 3B Taylor Ward,,,
398,1157929772,cotton1023 (2/3),0,64.45,P Lance Lynn P Thomas Pannone OF J.D. Martinez OF Mookie Betts 3B José Ramírez OF A.J. Pollock SS Trea Turner 2B David Fletcher 1B Josh Bell C René Rivera,,,
399,1157738608,Chaos2015 (2/2),0,64.4,P Ivan Nova P Jacob Nix OF Mike Trout SS Manny Machado OF Ronald Acuña Jr. 1B Matt Carpenter 3B Eugenio Suárez OF Bryce Harper 2B Javier Báez C Kurt Suzuki,,,
400,1157946868,LethargicLinemen (8/14),0,64.3,P Max Scherzer 3B Justin Turner OF Joc Pederson OF Brett Gardner OF George Springer SS Lourdes Gurriel Jr. 1B Daniel Murphy 2B Jeff McNeil C Victor Caratini P Noé Ramírez,,,
401,1157960967,Emac (6/14),0,64.1,P Lance Lynn P Brian Johnson OF J.D. Martinez 3B Max Muncy OF Andrew Benintendi 1B Mitch Moreland OF George Springer 2B Daniel Murphy SS Amed Rosario C René Rivera,,,
402,1157941468,blackhaze13,0,63.95,P Clay Buchholz P Junior Guerra OF Mike Trout OF J.D. Martinez 2B Rougned Odor OF Nomar Mazara C Francisco Cervelli 3B Adrián Beltré SS Elvis Andrus 1B Ronald Guzmán,,,
403,1157812377,cptnspaulding (10/14),0,63.4,P Max Scherzer P Félix Hernández 1B Joey Gallo OF Shin-soo Choo 2B Rougned Odor OF Adam Frazier C Francisco Cervelli OF Corey Dickerson 3B Adrián Beltré SS Elvis Andrus,,,
404,1157965878,SKG1000 (5/14),0,63.25,P Max Scherzer P Junior Guerra 1B Cody Bellinger OF Nick Markakis OF Andrew McCutchen OF Kevin Kiermaier SS Nick Ahmed C Tucker Barnhart 3B Maikel Franco 2B Ketel Marte,,,
405,1157973494,andrealking2 (11/14),0,62.95,P Max Scherzer P Charlie Morton OF George Springer 3B Jeimer Candelario 2B Jeff McNeil 1B Jim Adduci C Kevin Plawecki SS Amed Rosario OF Jay Bruce OF Austin Jackson,,,
406,1157989142,timothylee74 (3/14),0,62.2,P Max Scherzer P Clay Buchholz SS José Iglesias OF Kole Calhoun OF Adam Engel 1B Victor Martinez OF Craig Gentry 3B Taylor Ward 2B Ronny Rodriguez C Grayson Greiner,,,
407,1157906101,Patrick_Star (7/14),0,61.7,P Max Scherzer P Ivan Nova OF Khris Davis OF Ryan Braun 2B Travis Shaw 3B Matt Chapman 1B Matt Olson OF Ramón Laureano C Erik Kratz SS Orlando Arcia,,,
408,1157981784,botobrody (10/11),0,61.25,P Charlie Morton P Jakob Junis OF Mitch Haniger OF Denard Span 2B Robinson Canó OF Nelson Cruz SS Javier Báez 3B Kyle Seager 1B Daniel Murphy C Victor Caratini,,,
409,1157955982,LethargicLinemen (13/14),0,60.3,P Max Scherzer 3B Justin Turner OF Andrew Benintendi OF Lorenzo Cain SS Lourdes Gurriel Jr. 1B Daniel Murphy 2B Devon Travis OF Jason Heyward C Victor Caratini P Noé Ramírez,,,
410,1157738531,GoBeavs1992,0,59.65,P Matthew Boyd P Brian Johnson OF J.D. Martinez 1B Max Muncy 3B Matt Carpenter OF Kevin Pillar C Yadier Molina 2B Daniel Murphy SS Nick Ahmed OF Michael Conforto,,,
411,1157993666,tmjohnson1984,0,59.5,P Jack Flaherty P Brian Johnson 3B Alex Bregman 2B Jose Altuve OF Nicholas Castellanos OF Marwin González 1B Tyler White SS Freddy Galvis OF Franmil Reyes C Blake Swihart,,,
412,1157941243,jetman6,0,59.45,P Junior Guerra P Ivan Nova OF Mike Trout OF Mookie Betts OF Charlie Blackmon 3B Nolan Arenado SS Javier Báez 1B Ryan Zimmerman 2B Eduardo Núñez C Blake Swihart,,,
413,1157965191,andrealking2 (5/14),0,58.95,P Max Scherzer P Charlie Morton OF George Springer 3B Todd Frazier 2B Jeff McNeil 1B Jim Adduci SS José Iglesias C Kevin Plawecki OF Jay Bruce OF Austin Jackson,,,
414,1157906100,Patrick_Star (6/14),0,58.7,P Max Scherzer P Ivan Nova OF Joey Gallo 1B Justin Smoak OF Teoscar Hernández SS Aledmys Díaz OF Nomar Mazara C Robinson Chirinos 2B Devon Travis 3B Adrián Beltré,,,
414,1157973506,andrealking2 (14/14),0,58.7,P Max Scherzer P Ivan Nova OF Mike Trout OF Aaron Hicks 2B Jose Altuve OF George Springer SS Andrelton Simmons 3B David Fletcher 1B Jefry Marte C René Rivera,,,
416,1157945293,BeltWieldindad (14/14),0,58.65,P Charlie Morton P Lance Lynn OF Joc Pederson C Yasmani Grandal 2B Brian Dozier OF Nicholas Castellanos OF George Springer 3B Jeimer Candelario SS José Iglesias 1B Victor Martinez,,,
417,1157936908,bentleythepit (2/2),0,58.6,P Brian Johnson P Ivan Nova OF Ronald Acuña Jr. SS Xander Bogaerts OF Michael Brantley OF Ryan Braun C Yasmani Grandal 3B Miguel Andújar 2B Javier Báez 1B Yuli Gurriel,,,
418,1157737825,Chaos2015 (1/2),0,58.45,P Junior Guerra P Ivan Nova 3B Max Muncy OF Giancarlo Stanton SS Xander Bogaerts 1B Matt Carpenter OF Michael Brantley OF Bryce Harper 2B Jonathan Villar C Yadier Molina,,,
419,1157922074,Shaunovery (7/14),0,58.4,P Julio Teheran P Ivan Nova OF J.D. Martinez OF Mookie Betts OF Andrew Benintendi SS Xander Bogaerts 1B Mitch Moreland 3B Adrián Beltré C Curt Casali 2B Wilmer Difo,,,
420,1158005110,skaines (2/14),0,58.15,P Aaron Nola P Junior Guerra 3B José Ramírez OF Ronald Acuña Jr. 1B Cody Bellinger 2B Jeff McNeil OF Corey Dickerson OF Michael Conforto SS José Iglesias C Kevin Plawecki,,,
421,1157942161,Krewchief,0,58.05,P Cole Hamels P Junior Guerra OF Whit Merrifield 2B Jose Altuve 3B Miguel Andújar SS Trevor Story OF Rhys Hoskins C Yadier Molina OF Stephen Piscotty 1B Jake Bauers,,,
422,1157852420,charlesrayallday (5/14),0,57.75,P Max Scherzer P Matthew Boyd OF Nicholas Castellanos 1B Anthony Rizzo 3B Todd Frazier 2B Niko Goodrum OF Mikie Mahtook OF Michael Conforto SS Amed Rosario C James McCann,,,
423,1157994448,melmarco (2/2),0,57.3,P Max Scherzer OF Mookie Betts 1B Matt Carpenter SS Tim Anderson 3B Jurickson Profar C Omar Narváez OF Jon Jay 2B Ketel Marte OF Adam Engel P Noé Ramírez,,,
424,1158000783,timothylee74 (12/14),0,57.2,P Max Scherzer P Lance Lynn SS José Iglesias OF Kole Calhoun OF Adam Engel 1B Victor Martinez OF Craig Gentry 3B Taylor Ward 2B Ronny Rodriguez C Grayson Greiner,,,
425,1157986972,chrisgroce3425 (2/2),0,57.1,P Lance Lynn P Brian Johnson SS Xander Bogaerts OF Lorenzo Cain 2B Travis Shaw 3B Matt Chapman OF Nicholas Castellanos OF George Springer C Wilson Ramos 1B Daniel Murphy,,,
426,1157906104,Patrick_Star (10/14),0,56.7,P Max Scherzer P Ivan Nova OF Joey Gallo 1B Edwin Encarnacion OF Melky Cabrera 2B Jason Kipnis OF Nomar Mazara C Yan Gomes 3B Adrián Beltré SS Elvis Andrus,,,
427,1157965201,andrealking2 (8/14),0,56.2,P Max Scherzer P Madison Bumgarner 2B Jose Altuve OF Nicholas Castellanos OF Mikie Mahtook SS José Iglesias OF Kole Calhoun 3B David Fletcher 1B Victor Martinez C James McCann,,,
428,1157891737,9ordo6 (13/14),0,55.7,P Max Scherzer P Ivan Nova OF Mike Trout 2B Whit Merrifield 3B Todd Frazier 1B Tyler White C Salvador Perez OF Jorge Bonifacio SS Alcides Escobar OF Jay Bruce,,,
429,1157902964,Shawzie23,0,55.55,P Aaron Nola P Kyle Gibson 2B Jose Altuve SS Javier Báez 1B Anthony Rizzo OF George Springer OF Juan Soto OF Billy McKinney C Robinson Chirinos 3B Zach Vincej,,,
430,1157937616,ChappedAss,0,55.3,P Walker Buehler P Edwin Jackson OF Ronald Acuña Jr. SS Trevor Story 2B DJ LeMahieu OF Rhys Hoskins OF Juan Soto 3B Jeimer Candelario 1B Luke Voit C Francisco Cervelli,,,
430,1157975524,dofunnies (10/10),0,55.3,P Max Scherzer OF Mike Trout 3B José Ramírez 2B Jose Altuve C Danny Jansen SS Andrelton Simmons 1B Albert Pujols OF Kole Calhoun OF Eric Young Jr. P Noé Ramírez,,,
432,1157812378,cptnspaulding (11/14),0,55.2,P Charlie Morton P Matthew Boyd SS Alex Bregman 2B Jose Altuve OF George Springer OF Josh Reddick OF Nomar Mazara 1B Tyler White C Robinson Chirinos 3B Adrián Beltré,,,
432,1158000553,timothylee74 (11/14),0,55.2,P Max Scherzer P Julio Teheran SS José Iglesias OF Kole Calhoun OF Adam Engel 1B Victor Martinez OF Craig Gentry 3B Taylor Ward 2B Ronny Rodriguez C Grayson Greiner,,,
434,1157852445,charlesrayallday (12/14),0,54.75,P Max Scherzer P Matthew Boyd 2B Brian Dozier OF A.J. Pollock 3B Todd Frazier SS Eduardo Escobar 1B Daniel Murphy OF Steven Souza Jr. OF Jay Bruce C Jeff Mathis,,,
435,1157960889,MNRaider (11/14),0,54.7,P Charlie Morton P Junior Guerra OF Giancarlo Stanton 3B Matt Carpenter OF Tyler O'Neill OF Brett Gardner 2B Jedd Gyorko SS Paul DeJong C Yadier Molina 1B Luke Voit,,,
436,1157989362,timothylee74 (4/14),0,54.65,P Max Scherzer P Walker Buehler SS José Iglesias OF Kole Calhoun OF Adam Engel 1B Victor Martinez OF Craig Gentry 3B Taylor Ward 2B Ronny Rodriguez C Grayson Greiner,,,
437,1157992784,lmv23 (2/2),0,53.35,P Charlie Morton P Ryne Stanek OF J.D. Martinez OF Cody Bellinger OF Shin-soo Choo SS Javier Báez 3B Jurickson Profar 2B Yoán Moncada C Danny Jansen 1B Daniel Murphy,,,
438,1157946866,LethargicLinemen (7/14),0,53.3,P Max Scherzer OF Joc Pederson OF Shin-soo Choo OF Lorenzo Cain 1B Mitch Moreland C Yadier Molina 3B Jeimer Candelario 2B Daniel Murphy SS Amed Rosario P Noé Ramírez,,,
439,1157948933,akAAK (1/2),0,53,P Matthew Boyd P Thomas Pannone OF J.D. Martinez 1B Matt Carpenter SS Jean Segura OF Nicholas Castellanos OF Kevin Pillar 2B Joey Wendle 3B Jeimer Candelario C Bryan Holaday,,,
440,1157966841,dofunnies (1/10),0,52.7,P Max Scherzer P Ivan Nova 3B José Ramírez OF Gregory Polanco SS Javier Báez OF Starling Marte 2B Asdrúbal Cabrera C Francisco Cervelli OF Corey Dickerson 1B Josh Bell,,,
441,1157966888,dofunnies (4/10),0,51.5,P Charlie Morton P Ariel Jurado OF Mookie Betts SS Francisco Lindor 1B Joey Gallo OF Shin-soo Choo 2B Rougned Odor 3B Jurickson Profar OF Nomar Mazara C Erik Kratz,,,
442,1157997975,timothylee74 (9/14),0,50.95,P Max Scherzer P Charlie Morton SS José Iglesias OF Kole Calhoun OF Adam Engel 1B Victor Martinez OF Craig Gentry 3B Taylor Ward 2B Ronny Rodriguez C Grayson Greiner,,,
443,1157998982,timothylee74 (10/14),0,50.75,P Max Scherzer P Matthew Boyd SS José Iglesias OF Kole Calhoun OF Adam Engel 1B Victor Martinez OF Craig Gentry 3B Taylor Ward 2B Ronny Rodriguez C Grayson Greiner,,,
444,1157975492,dofunnies (9/10),0,50.65,P Charlie Morton P Jacob Nix OF Mike Trout OF J.D. Martinez 2B Jose Altuve 3B Wil Myers 1B Eric Hosmer OF Hunter Renfroe SS Freddy Galvis C Austin Hedges,,,
444,1158005522,whoisjohngalt420 (3/6),0,50.65,P Matthew Boyd P Brian Johnson OF Mookie Betts C Yasmani Grandal 3B Wil Myers SS Marwin González 1B Eric Hosmer OF George Springer OF Andrew McCutchen 2B Niko Goodrum,,,
446,1157981510,melmarco (1/2),0,50.3,P Max Scherzer OF Mookie Betts OF Giancarlo Stanton SS Tim Anderson 3B Brian Anderson C Omar Narváez OF Gerardo Parra 1B Albert Pujols 2B Logan Forsythe P Noé Ramírez,,,
447,1157843983,charlesrayallday (3/14),0,48.75,P Max Scherzer P Matthew Boyd OF A.J. Pollock 1B Anthony Rizzo 3B Todd Frazier 2B Daniel Murphy OF Michael Conforto OF Steven Souza Jr. SS Ketel Marte C Jeff Mathis,,,
448,1158001095,timothylee74 (14/14),0,48.65,P Max Scherzer P Kyle Gibson SS José Iglesias OF Kole Calhoun OF Adam Engel 1B Victor Martinez OF Craig Gentry 3B Taylor Ward 2B Ronny Rodriguez C Grayson Greiner,,,
449,1157963226,davidpack525,0,47.65,P Thomas Pannone P Brian Johnson OF Mike Trout OF J.D. Martinez OF Mookie Betts C Yasmani Grandal 2B Devon Travis SS José Iglesias 3B David Bote 1B Ronald Guzmán,,,
450,1158010738,slydernelson,0,47.5,P Matthew Boyd P Junior Guerra 3B Alex Bregman OF Giancarlo Stanton 1B Matt Carpenter OF Mitch Haniger OF Lorenzo Cain 2B DJ LeMahieu C Omar Narváez SS Andrelton Simmons,,,
451,1157906078,Patrick_Star (1/14),0,46.7,P Max Scherzer P Ivan Nova 2B Robinson Canó OF Nelson Cruz SS Marwin González OF George Springer OF Josh Reddick 1B Tyler White 3B Kyle Seager C Mike Zunino,,,
452,1157953753,ImnotNavT (8/14),0,45.2,P Charlie Morton P Thomas Pannone OF Giancarlo Stanton 1B Matt Carpenter OF Joc Pederson 3B Todd Frazier 2B Jeff McNeil OF Michael Conforto C Kevin Plawecki SS Amed Rosario,,,
453,1157886117,jayturn21 (1/3),0,44.75,P Max Scherzer P Thomas Pannone OF Mitch Haniger SS Marwin González OF Starling Marte 3B Anthony Rendon 1B Albert Pujols OF Steven Souza Jr. 2B Joe Panik C Nick Hundley,,,
454,1157999656,davy608 (1/2),0,43.95,P Lance Lynn P Junior Guerra 1B Matt Carpenter OF Khris Davis OF Bryce Harper SS Jean Segura 3B Nolan Arenado 2B Robinson Canó OF Nelson Cruz C Austin Hedges,,,
